{
  "$schema": "https://json-schema.org/draft/2020-12/schema",
  "$id": "repo/schemas/repo-spec.schema.json",
  "title": "Repository Spec Schema",
  "type": "object",
  "additionalProperties": false,
  "required": [
    "spec_id",
    "title",
    "purpose",
    "status",
    "schema_version",
    "normative_requirements",
    "dependencies",
    "references",
    "derived_artifacts"
  ],
  "properties": {
    "spec_id": {
      "type": "string",
      "pattern": "^repo\\.[a-z][a-z0-9]*(?:-[a-z0-9]+)*(?:\\.[a-z][a-z0-9]*(?:-[a-z0-9]+)*)*$"
    },
    "title": {
      "type": "string",
      "minLength": 1
    },
    "purpose": {
      "type": "string",
      "minLength": 1
    },
    "status": {
      "type": "string",
      "enum": ["candidate", "accepted", "superseded", "retired"]
    },
    "schema_version": {
      "type": "string",
      "const": "1"
    },
    "issue_fields": {
      "type": "array",
      "items": { "$ref": "#/$defs/field" }
    },
    "review_fields": {
      "type": "array",
      "items": { "$ref": "#/$defs/field" }
    },
    "supersedes": {
      "type": "array",
      "items": { "$ref": "#/$defs/specId" }
    },
    "superseded_by": {
      "type": "array",
      "items": { "$ref": "#/$defs/specId" }
    },
    "normative_requirements": {
      "type": "array",
      "items": { "$ref": "#/$defs/requirement" }
    },
    "dependencies": {
      "type": "array",
      "items": { "$ref": "#/$defs/dependency" }
    },
    "references": {
      "type": "array",
      "items": { "$ref": "#/$defs/reference" }
    },
    "derived_artifacts": {
      "type": "array",
      "items": { "$ref": "#/$defs/derivedArtifact" }
    }
  },
  "$defs": {
    "requirement": {
      "type": "object",
      "additionalProperties": false,
      "required": ["id", "text"],
      "properties": {
        "id": {
          "type": "string",
          "minLength": 1
        },
        "text": {
          "type": "string",
          "minLength": 1
        }
      }
    },
    "dependency": {
      "type": "object",
      "additionalProperties": false,
      "required": ["spec_id"],
      "properties": {
        "spec_id": {
          "type": "string",
          "pattern": "^repo\\.[a-z][a-z0-9]*(?:-[a-z0-9]+)*(?:\\.[a-z][a-z0-9]*(?:-[a-z0-9]+)*)*$"
        }
      }
    },
    "reference": {
      "oneOf": [
        {
          "type": "object",
          "additionalProperties": false,
          "required": ["type", "spec_id"],
          "properties": {
            "type": {
              "type": "string",
              "const": "specification"
            },
            "kind": {
              "type": "string",
              "enum": ["normative", "historical"]
            },
            "spec_id": {
              "type": "string",
              "pattern": "^repo\\.[a-z][a-z0-9]*(?:-[a-z0-9]+)*(?:\\.[a-z][a-z0-9]*(?:-[a-z0-9]+)*)*$"
            }
          }
        },
        {
          "type": "object",
          "additionalProperties": false,
          "required": ["type", "path"],
          "properties": {
            "type": {
              "type": "string",
              "const": "artifact"
            },
            "path": {
              "type": "string",
              "pattern": "^(?!/)(?!.*\\\\)(?!.*(?:^|/)\\.\\.(?:/|$))(?!.*//).+$",
              "minLength": 1
            }
          }
        }
      ]
    },
    "derivedArtifact": {
      "type": "object",
      "additionalProperties": false,
      "required": ["type", "path"],
      "properties": {
        "type": {
          "type": "string",
          "enum": ["markdown", "yaml"]
        },
        "path": {
          "type": "string",
          "pattern": "^(?!/)(?!.*\\\\)(?!.*(?:^|/)\\.\\.(?:/|$))(?!.*//).+$",
          "minLength": 1
        },
        "renderer": {
          "type": "string",
          "minLength": 1
        }
      }
    },
    "field": {
      "type": "object",
      "additionalProperties": false,
      "required": ["id", "label", "required", "input_type", "description", "placeholder"],
      "properties": {
        "id": {
          "type": "string",
          "minLength": 1
        },
        "label": {
          "type": "string",
          "minLength": 1
        },
        "required": {
          "type": "boolean"
        },
        "input_type": {
          "type": "string",
          "enum": ["input", "textarea"]
        },
        "description": {
          "type": "string",
          "minLength": 1
        },
        "placeholder": {
          "type": "string",
          "minLength": 1
        },
        "validation": {
          "$ref": "#/$defs/validation"
        }
      }
    },
    "validation": {
      "type": "object",
      "additionalProperties": false,
      "required": ["kind"],
      "properties": {
        "kind": {
          "type": "string",
          "enum": ["meaningful", "issue-link", "commit-sha", "spec-reference", "path-list", "numbered-steps", "checklist", "default-branch-base"]
        },
        "allow_none": {
          "type": "boolean"
        },
        "count": {
          "type": "integer"
        },
        "branch": {
          "type": "string",
          "minLength": 1
        },
        "items": {
          "type": "array",
          "items": {
            "type": "string",
            "minLength": 1
          }
        }
      }
    },
    "specId": {
      "type": "string",
      "pattern": "^repo\\.[a-z][a-z0-9]*(?:-[a-z0-9]+)*(?:\\.[a-z][a-z0-9]*(?:-[a-z0-9]+)*)*$"
    }
  }
}
