{
  "spec_id": "repo.product-decomposition",
  "title": "Product Decomposition Contract",
  "purpose": "Defines the directional, non-normative contract for product decomposition documents.",
  "status": "accepted",
  "schema_version": "1",
  "normative_requirements": [
    {
      "id": "REPO-PDC-001",
      "text": "A product decomposition shall be stored under the owner-specific decomposition root defined by `repo.development-document-base`: repository/framework-owned decompositions under `repo/docs/decompositions/` and product-owned decompositions under `product/docs/decompositions/`. It shall use the canonical top-level `*-DECOMPOSITION.md` controlling document plus subordinate chunks."
    },
    {
      "id": "REPO-PDC-002",
      "text": "A product decomposition shall record the controlling approved functional set, controlling documents, predecessor documents, evidence, document-wide decomposition obligations, bounded product-area inventory, stable product-area identifiers, required content areas, permitted chunk roles, product-defined areas, chunk-level document coverage, standardized product-area section headings, per-area structural coverage, dependencies, exclusions, cross-cutting concerns, unresolved decisions, stopping criteria, planning handoff, likely successor planning or specification work, and the authorized next planning action."
    },
    {
      "id": "REPO-PDC-003",
      "text": "A product decomposition shall remain directional and non-normative and shall not define exact product behavior, select implementation architecture without later authority, accept product specifications, or conceal unresolved semantic decisions."
    },
    {
      "id": "REPO-PDC-004",
      "text": "The top-level controlling document shall act as the index, status declaration, and navigation entry point for the decomposition composite document."
    },
    {
      "id": "REPO-PDC-005",
      "text": "A product decomposition shall keep each bounded area coherent and shall not mix unrelated lifecycle stages or authority domains within one area."
    },
    {
      "id": "REPO-PDC-006",
      "text": "A product decomposition shall make the next authorized planning action explicit so later work does not have to infer it from conversation history."
    },
    {
      "id": "REPO-PDC-007",
      "text": "A product decomposition shall identify the expected Level 0–3 product-specification families, their responsibility boundaries, intended dependency direction, known cross-specification relationships, unresolved semantic decisions, specification work required before implementation planning, and areas that do not require separate specification artifacts. This identification shall remain directional and shall not prematurely define normative product semantics."
    }
  ],
  "dependencies": [
    {
      "spec_id": "repo.development-document-base"
    },
    {
      "spec_id": "repo.repository-structure"
    },
    {
      "spec_id": "repo.validation"
    },
    {
      "spec_id": "repo.development-workflow"
    }
  ],
  "references": [
    {
      "type": "specification",
      "spec_id": "repo.development-document-base"
    },
    {
      "type": "specification",
      "spec_id": "repo.repository-structure"
    },
    {
      "type": "specification",
      "spec_id": "repo.validation"
    },
    {
      "type": "specification",
      "spec_id": "repo.development-workflow"
    }
  ],
  "derived_artifacts": [
    {
      "type": "markdown",
      "path": "repo/derived/specs/repo/product-decomposition.md"
    }
  ]
}
