{
  "spec_id": "repo.development-workflow",
  "title": "Development Workflow",
  "purpose": "Defines the governed development process for bounded repository changes.",
  "status": "accepted",
  "schema_version": "1",
  "normative_requirements": [
    {
      "id": "REPO-WF-001",
      "text": "The repository shall require a governing issue, an isolated branch, validation, push, and PR for bounded changes."
    },
    {
      "id": "REPO-WF-002",
      "text": "Before any repository mutation, the chatbot shall initialize by reading README.md, discovering the authoritative manifest, reading the accepted development-workflow specification, discovering an existing governing issue or creating one when authorized by REPO-WF-003, then identifying and reading the resulting governing issue, loading only relevant overview, decomposition, plan, specification, and predecessor records, inspecting the actual Git branch, open pull requests, accepted base, working tree, remote state, and hosting-platform state, verifying that the branch recorded in the accepted default-branch base is the repository's actual current default branch, reporting the governing issue, controlling authority, accepted base, intended branch, scope, exclusions, dependencies, next authorized action, and unresolved authority conflicts, stopping when controlling authority is missing or conflicting except that absence of a governing issue shall follow the explicit discovery-or-create procedure in REPO-WF-003, and withholding mutation until initialization is complete."
    },
    {
      "id": "REPO-WF-003",
      "text": "When starting a bounded change, the chatbot shall inspect the user request, current branch, open PRs, repository records, and hosting-platform state for an existing governing issue; if exactly one open issue governs the requested work, it shall be reused; if none exists, the chatbot shall create one before any branch is created; if multiple issues could govern the work or the issue does not clearly authorize it, the chatbot shall stop and ask for clarification without creating a duplicate issue."
    },
    {
      "id": "REPO-WF-004",
      "text": "The chatbot shall determine the intended branch from the governing issue and the convention issue-<number>-<short-slug>, search local and remote refs for that branch, verify an existing branch corresponds to the governing issue and its recorded base, and reuse it only if its commits and working-tree changes remain within scope and will not overwrite or mix unrelated work; if no valid branch exists, the chatbot shall create it from the exact accepted base recorded for the issue."
    },
    {
      "id": "REPO-WF-005",
      "text": "The chatbot shall report whether the issue and branch were reused or created, along with the issue number, accepted base, current branch, scope, exclusions, and next authorized action, and shall not mutate repository source until the governing issue and issue branch have been discovered or created and verified."
    },
    {
      "id": "REPO-WF-006",
      "text": "When creating or updating a GitHub issue or pull request body, the chatbot shall pass the body as a literal Markdown payload or file contents and shall not allow shell interpolation, command substitution, or concatenated command output to alter the intended Markdown structure."
    },
    {
      "id": "REPO-WF-007",
      "text": "The normative development lifecycle for product development shall be: accepted overview, accepted decomposition, accepted product specifications (Level 0\u20133 in dependency order), accepted implementation plan, governed implementation issues, and product artifacts. Each stage shall require acceptance of its predecessor stage before the next stage may be accepted, unless a later stage's governing specification explicitly permits concurrent drafting without acceptance."
    },
    {
      "id": "REPO-WF-008",
      "text": "A product overview must be accepted before a product decomposition may be accepted. An initial overview satisfies this requirement through its governing-issue bootstrap authority."
    },
    {
      "id": "REPO-WF-009",
      "text": "A product decomposition must be accepted before the controlling product-specification set for the corresponding implementation scope may be finalized and accepted."
    },
    {
      "id": "REPO-WF-010",
      "text": "All product specifications necessary to govern a planned implementation scope must be accepted before the corresponding implementation plan may become accepted. An implementation plan whose required controlling product specifications are missing, merely placeholder scaffolding, candidate where acceptance is required, structurally invalid, mutually contradictory, absent from the product manifest, or missing required correspondence or dependency declarations shall not be accepted."
    },
    {
      "id": "REPO-WF-011",
      "text": "Before any source mutation that creates or modifies maintained product artifacts, the workflow initialization shall verify that applicable accepted product specifications exist for the planned implementation scope. Initialization shall stop before source mutation when applicable product specifications are missing or their acceptance status conflicts with the planned work."
    },
    {
      "id": "REPO-WF-012",
      "text": "Code, tests, schemas, templates, generated output, and prior implementation behavior shall not become product authority merely because they exist. Only accepted product specifications may define normative product semantics."
    },
    {
      "id": "REPO-WF-013",
      "text": "A material specification change (including revision, supersession, or retirement of an accepted specification that an implementation plan relies upon) must trigger an implementation-plan impact review. Affected plan sections must be revised or explicitly reaffirmed before implementation under the changed authority may proceed. Implementation must pause where the accepted specification and plan no longer agree."
    },
    {
      "id": "REPO-WF-014",
      "text": "A material implementation-plan change (including sequencing or scope changes) must be reflected in the controlling plan before affected open governing issues are updated. Completed implementation must be audited when controlling authority changes materially, and the audit results must be recorded before successor implementation proceeds."
    },
    {
      "id": "REPO-WF-015",
      "text": "The repository may classify explicitly non-product exploratory experiments. An exploratory experiment shall be isolated from maintained product paths where practical, shall not claim conformance, acceptance, release, or product status, shall not silently become maintained implementation, shall require a later governed specification and implementation process before adoption, and shall have explicit disposal, archival, or adoption criteria. Adoption of experimental work shall require accepted product specifications and an accepted implementation plan before maintained implementation may begin."
    },
    {
      "id": "REPO-WF-016",
      "text": "A product-artifact governing issue that creates or modifies maintained product artifacts shall cite the accepted implementation plan, the applicable accepted product specifications, the exact accepted default-branch base, and predecessor implementation evidence."
    }
  ],
  "dependencies": [
    {
      "spec_id": "repo.manifest"
    },
    {
      "spec_id": "repo.repository-structure"
    }
  ],
  "references": [
    {
      "type": "specification",
      "spec_id": "repo.manifest"
    },
    {
      "type": "specification",
      "spec_id": "repo.repository-structure"
    },
    {
      "type": "specification",
      "spec_id": "repo.product-levels"
    },
    {
      "type": "specification",
      "spec_id": "repo.implementation-plan"
    },
    {
      "type": "specification",
      "spec_id": "repo.product-decomposition"
    },
    {
      "type": "artifact",
      "path": "AGENTS.md"
    },
    {
      "type": "artifact",
      "path": "repo/docs/overview/product-overview/04-git-and-change-workflow.md"
    }
  ],
  "derived_artifacts": [
    {
      "type": "markdown",
      "path": "repo/derived/specs/repo/development-workflow.md"
    }
  ]
}
